topic,top_terms
topic_0,"interrupt, address, data, instruction, program, program interrupt, storage, data storage, storage interrupt, ciod"
topic_1,"core, generating, generating core, auselton bgl, auselton, home auselton, temporarily, fields line, fields, unavailable"
topic_2,"microseconds, dear, iar, input, critical input, critical, interrupts, total, time, input interrupts"
topic_3,"ciod, program, error, ciod error, invalid, missing, image, error loading, program image, loading"
topic_4,"error, cache, parity, parity error, corrected, instruction cache, error corrected, instruction, cache parity, corrected instruction"
topic_5,"ce, ce sym, sym, mask, detected, detected corrected, corrected, ddr, error, error detected"
topic_6,"alignment, exceptions, alignment exceptions, hummer, hummer alignment, double hummer, double, floating point, point, floating"
topic_7,"source, assert, idotransportmgr, node, card, file, line, idoproxydb, int, hit assert"
